{
  "$schema": "../../schema/manifest.v1.json",
  "schemaVersion": 1,
  "sheet": {
    "file": "enemy-bosses.png",
    "width": 256,
    "height": 288,
    "format": "png32",
    "premultipliedAlpha": false
  },
  "frameWidth": 64,
  "frameHeight": 72,
  "pivot": { "x": 32, "y": 36 },
  "animations": {
    "idle": { "row": 0, "column": 0, "frameCount": 4, "frameDurationMs": 140 },
    "run": { "row": 1, "column": 0, "frameCount": 4, "frameDurationMs": 140 }
  },
  "entities": {
    "brute": {
      "row": 0,
      "column": 0,
      "spriteWidth": 64,
      "spriteHeight": 72,
      "scale": 1,
      "hitboxTolerance": { "x": 0.82, "y": 0.87 }
    },
    "necro_lord": {
      "row": 2,
      "column": 0,
      "spriteWidth": 37,
      "spriteHeight": 53,
      "scale": 1,
      "hitboxTolerance": { "x": 1.03, "y": 1.06 }
    }
  }
}
